,sic_code,SubActivity
978,9211,"Motion picture production on film or video, Other motion picture and video production activities"
984,9212,Motion picture and video distribution
987,9213,Motion picture projection
988,2214,Publishing of sound recordings
990,7487,Other business activities not elsewhere classified
992,9220,Radio activities
993,6420,Telecommunications
1004,7222,Other software consultancy and supply
1009,7210,Hardware consultancy
1011,7230,Data processing
1014,7260,Other computer related activities
1018,9240,News agency activities
1020,6511,Central banking
1021,6512,"Banks,Building societies"
1023,7415,"Management activities of other non-financial holding companies,production holding companies, construction holding companies, wholesale holding companies, motor trades holding companies, retail holding companies"
1029,6523, "Activities of bank holding companies Financial intermediation not elsewhere classified"
1031,7415,"Management activities of transport holding companies, catering holding companies, service trades holding companies"
1035,6523,"Activities of investment trusts,unit trusts, venture and development capital companies,open-ended investment companies,property unit trusts"
1041,6521,Financial leasing
1042,6522,"Credit granting by non-deposit taking finance houses and other specialist consumer credit grantors,Activities of mortgage finance companies,Other credit granting not elsewhere classified"
1045,6523,Security dealing on own account
1046,6522,Factoring
1048,6601,Life insurance
1049,6603,Non-life insurance
1051,6602,Pension funding
1054,6711,Administration of financial markets
1055,6712,Security broking and fund management
1056,6713,Activities auxiliary to financial intermediation n.e.c.
1058,6720,Activities auxiliary to insurance and pension funding
1061,6712,Fund management activities
1062,7012,Buying and selling of own real estate
1063,7020,"Other letting of own property, Letting of conference and exhibition centres"
1066,7031,Real estate agencies
1067,7032,Management of real estate on a fee or contract basis
1068,7411,"Barristers at law,Solicitors,Activities of patent and copyright agents,Other legal activities not elsewhere classified"
1072,7412,"Accounting and auditing activities,Book-keeping activities,Tax consultancy"
1084,7414,"Public relations activities,Financial management,General management consultancy activities"
1089,7420,"Architectural,Urban planning and landscape architectural activities, Engineering design activities for industrial process and production, Engineering related scientific and technical consulting activities,Engineering consultative and design activities"
1094,7420,Other engineering activities
1095,7430,Technical testing and analysis
1096,7310,Research and experimental development on natural sciences and engineering
1099,7320,Research and experimental development on social sciences and humanities
1100,7440,"Planning, creation and placement of advertising activities, Advertising activities not elsewhere classified,Sale or leasing activities of advertising space or time"
1103,7413,Market research and public opinion polling
1104,7487,Specialty design activities
1105,7481,"Portrait photographic activities,Other specialist photography,Film processing,Photographic activities not elsewhere classified"
1111,7485,Secretarial and translation activities
1113,7420,Quantity surveying activities
1117,7460,Security and related activities
1119,8520,Veterinary activities
1120,7110,Renting of automobiles
1121,7121,Renting of other land transport equipment
1122,7140,"Renting of sporting and recreational equipment,Renting of records and other pre-recorded media,Renting of video tapes and DVDs,Renting of radios, televisions and video recorders and DVD players, Renting of other personal and household goods not elsewhere classified"
1128,7131,Renting of agricultural machinery and equipment
1129,7132,Renting of construction and civil engineering machinery and equipment
1130,7133,"Renting of office machinery and equipment, including computers"
1131,7122,"Renting of passenger water transport equipment,Renting of other water transport equipment"
1133,7123,"Renting of passenger air transport equipment,Renting of other air transport equipment"
1135,7121,Renting of passenger land transport equipment
1138,7134,Renting of other machinery and equipment n.e.c.
1140,7450,Labour recruitment and provision of personnel
1141,9272,"Motion picture, television and other theatrical casting"
1145,6330,"Activities of travel agencies, organisers,tour guides,Other tourist assistance activities n.e.c."
1149,9232,Operation of arts facilities
1150,9234,Other entertainment activities not elsewhere classified
1151,9262,Other sporting activities not elsewhere classified
1156,7460,Investigation activities
1158,7514,Supporting service activities for the government as a whole
1159,7470,"Traditional cleaning services,Window cleaning services,Specialised cleaning services,Furnace and chimney cleaning services,Cleaning activities not elsewhere classified,Disinfecting and exterminating services"
1171,7486,Call centre activities
1172,7487,"Activities of exhibition and fair organisers,Activities of conference organisers,Credit reporting and collection agency activities"
1176,7482,Packaging activities
1179,7513,Regulation of and contribution to more efficient operation of business
1180,7511,General (overall) public service activities
1182,7512,"Regulation of the activities of agencies that provide health care, education, cultural services and other social services, excluding social security"
1184,7521,Foreign affairs
1185,7522,Defence activities
1186,7523,Justice and judicial activities
1187,7524,"Public security, law and order activities"
1188,7525,Fire service activities
1189,7530,Compulsory social security activities
1190,8010,Primary education
1192,8021,General secondary education
1195,8022,Technical and vocational secondary education
1196,8042,Other adult and other education n.e.c.
1197,8030,Sub-degree level higher education
1198,8030,First-degree level higher education
1199,8030,Post-graduate level higher education
1202,9305,Other service activities n.e.c.
1204,9234,Dance halls and dancing instructor activities
1205,8041,Driving school activities
1206,8042,Activities of private training providers
1209,8511,"Public sector hospital activities, including NHS trusts, Private sector hospital activities,Medical nursing home activities"
1212,8512,Medical practice activities
1214,8513,Dental practice activities
1215,8514,Other human health activities
1220,8531,Charitable social work activities with accommodation
1221,8531,Non-charitable social work activities with accommodation
1227,8532,"Charitable social work activities without accommodation,Non-charitable social work activities without accommodation"
1234,9231,"Live theatrical presentations,Other artistic and literary creation and interpretation,Library and archives activities"
1246,9252,"Museums activities,Preservation of historical sites and buildings"
1248,9253,Botanical and zoological gardens and nature reserves activities
1249,9271,Gambling and betting activities
1250,9261,"Operation of ice rinks and roller skating rinks,Operation of other sports arenas and stadiums not elsewhere classified"
1254,9304,Physical well-being activities
1255,9262,Activities of racehorse owners
1257,9233,Fair and amusement park activities
1263,9111,Activities of business and employers' organizations
1264,9112,Activities of professional organizations
1265,9120,Activities of trade unions
1266,9131,Activities of religious organizations
1267,9132,Activities of political organizations
1269,9133,Activities of other membership organizations n.e.c.
1275,5272,Repair of electrical household goods
1279,5271,"Repair of boots, shoes and other articles of leather"
1286,5273,"Repair of watches, clocks and jewellery"
1290,9301,Washing and dry-cleaning of textile and fur products
1291,9302,Hairdressing and other beauty treatment
1292,9303,Funeral and related activities
1295,9305,Operation of coin-operated photographic machines
1297,9500,Activities of households as employers of domestic staff
1298,9600,Undifferentiated goods producing activities of private households for own use
1299,9700,Undifferentiated services producing activities of private households for own use
1300,9900,Extra-territorial organizations and bodies
