Id,Label,timeset,subactivity,mainindustry,componentnumber,modularity_class,mainactivity,clustering,triangles,Degree,Weighted Degree,Eccentricity,closnesscentrality,harmonicclosnesscentrality,betweenesscentrality,eigencentrality
1542,,,Manufacture of refined oils and fats,Manufacture of Food,126,0,Manufacture of Food; Beverages & Tobacco,0,0,0,0,0,0,0,0,0
4512,,,Test drilling and boring,Construction,127,0,Construction,0,0,0,0,0,0,0,0,0
0,,,,,128,0,,0,0,0,0,0,0,0,0,0
150,,,"Hunting, trapping and game propagation, including related service activities","Agriculture, Hunting and Forestry",129,0,"Agriculture, Hunting and Forestry",0,0,0,0,0,0,0,0,0
1020,,,Mining and agglomeration of lignite,Minning,130,0,Mining and Quarrying,0,0,0,0,0,0,0,0,0
1030,,,Extraction and agglomeration of peat,Minning,131,0,Mining and Quarrying,0,0,0,0,0,0,0,0,0
1200,,,Mining of uranium and thorium ores,Minning,132,0,Mining and Quarrying,0,0,0,0,0,0,0,0,0
1310,,,Mining of iron ores,Minning,133,0,Mining and Quarrying,0,0,0,0,0,0,0,0,0
1320,,,"Mining of non-ferrous metal ores, except uranium and thorium ores",Minning,134,0,Mining and Quarrying,0,0,0,0,0,0,0,0,0
1413,,,Quarrying of slate,Minning,135,0,Mining and Quarrying,0,0,0,0,0,0,0,0,0
1440,,,Production of salt,Minning,136,0,Mining and Quarrying,0,0,0,0,0,0,0,0,0
1450,,,Other mining and quarrying n.e.c.,Minning,137,0,Mining and Quarrying,0,0,0,0,0,0,0,0,0
1541,,,Manufacture of crude oils and fats,Manufacture of Food,138,0,Manufacture of Food; Beverages & Tobacco,0,0,0,0,0,0,0,0,0
1592,,,Production of ethyl alcohol from fermented materials,Manufacture of Food,139,0,Manufacture of Food; Beverages & Tobacco,0,0,0,0,0,0,0,0,0
1593,,,Manufacture of wine of fresh grapes and grape juice Manufacture of wine based on concentrated grape must,Manufacture of Food,140,0,Manufacture of Food; Beverages & Tobacco,0,0,0,0,0,0,0,0,0
1595,,,Manufacture of other non-distilled fermented beverages,Manufacture of Food,141,0,Manufacture of Food; Beverages & Tobacco,0,0,0,0,0,0,0,0,0
1714,,,Preparation and spinning of flax-type fibres,Manufacture of Textiles and Leather,142,0,Manufacture of Textiles & Textile Products,0,0,0,0,0,0,0,0,0
1717,,,Preparation and spinning of other textile fibres,Manufacture of Textiles and Leather,143,0,Manufacture of Textiles & Textile Products,0,0,0,0,0,0,0,0,0
1810,,,Manufacture of leather clothes,Manufacture of Textiles and Leather,144,0,Manufacture of Textiles & Textile Products,0,0,0,0,0,0,0,0,0
1830,,,Dressing and dyeing of fur; manufacture of articles of fur,Manufacture of Textiles and Leather,145,0,Manufacture of Textiles & Textile Products,0,0,0,0,0,0,0,0,0
2052,,,"Manufacture of articles of cork, straw and plaiting materials",Manufacture Paper; Publishing; Printing,146,0,Manufacture Paper; Publishing; Printing,0,0,0,0,0,0,0,0,0
2111,,,Manufacture of pulp,Manufacture Paper; Publishing; Printing,147,0,Manufacture Paper; Publishing; Printing,0,0,0,0,0,0,0,0,0
2214,,,Publishing of sound recordings,Manufacture Paper; Publishing; Printing,148,0,Manufacture Paper; Publishing; Printing,0,0,0,0,0,0,0,0,0
2465,,,Manufacture of prepared unrecorded media,Manufacture Chemicals/Plastics,149,0,"Manufacture Chemicals, Prods & Man-Made",0,0,0,0,0,0,0,0,0
2623,,,Manufacture of ceramic insulators and insulating fittings,Manufacture Other,150,0,Manufacture Other Non-Metal Mineral Products,0,0,0,0,0,0,0,0,0
2625,,,Manufacture of other ceramic products,Manufacture Other,151,0,Manufacture Other Non-Metal Mineral Products,0,0,0,0,0,0,0,0,0
2652,,,Manufacture of lime,Manufacture Other,152,0,Manufacture Other Non-Metal Mineral Products,0,0,0,0,0,0,0,0,0
2653,,,Manufacture of plaster,Manufacture Other,153,0,Manufacture Other Non-Metal Mineral Products,0,0,0,0,0,0,0,0,0
2664,,,Manufacture of mortars,Manufacture Other,154,0,Manufacture Other Non-Metal Mineral Products,0,0,0,0,0,0,0,0,0
2731,,,Cold drawing,Metals,155,0,Basic Metals & Fabricated Products,0,0,0,0,0,0,0,0,0
3541,,,Manufacture of motorcycles,Manufacture of Transport Equipment,156,0,Manufacture of Other Transport Equipment,0,0,0,0,0,0,0,0,0
3550,,,Manufacture of other transport equipment n.e.c.,Manufacture of Transport Equipment,157,0,Manufacture of Other Transport Equipment,0,0,0,0,0,0,0,0,0
3621,,,Striking of coins,Manufacture Other,158,0,Manufacturing nec,0,0,0,0,0,0,0,0,0
3661,,,Manufacture of imitation jewellery,Manufacture Other,159,0,Manufacturing nec,0,0,0,0,0,0,0,0,0
4030,,,Steam and hot water supply,"Electricity, Gas and Water Supply",160,0,"Electricity, Gas and Water Supply",0,0,0,0,0,0,0,0,0
5123,,,Wholesale of live animals,Retail,161,0,"Wholesale, Retail; Certain Repair (cont.)",0,0,0,0,0,0,0,0,0
5125,,,Wholesale of unmanufactured tobacco,Retail,162,0,"Wholesale, Retail; Certain Repair (cont.)",0,0,0,0,0,0,0,0,0
5183,,,Wholesale of machinery for the textile industry and of sewing and knitting machines,Retail,163,0,Wholesale of other household goods n.e.c.,0,0,0,0,0,0,0,0,0
5223,,,"Retail sale of fish, crustaceans and molluscs",Retail,164,0,"Retail Trade, Not Motors; Repairs",0,0,0,0,0,0,0,0,0
5273,,,"Repair of watches, clocks and jewellery",Retail,165,0,"Retail Trade, Not Motors; Repairs",0,0,0,0,0,0,0,0,0
6030,,,Transport via pipelines,Transport,166,0,Transport,0,0,0,0,0,0,0,0,0
6230,,,Space transport,Transport,167,0,Transport,0,0,0,0,0,0,0,0,0
7012,,,Buying and selling of own real estate,Buisness activities,168,0,"Real Estate, Renting & Business",0,0,0,0,0,0,0,0,0
7122,,,"Renting of passenger water transport equipment,Renting of other water transport equipment",Buisness activities,169,0,Renting Equipment Without Operator,0,0,0,0,0,0,0,0,0
7123,,,"Renting of passenger air transport equipment,Renting of other air transport equipment",Buisness activities,170,0,Renting Equipment Without Operator,0,0,0,0,0,0,0,0,0
9600,,,Undifferentiated goods producing activities of private households for own use,Services,171,0,Other Service Activities,0,0,0,0,0,0,0,0,0
9700,,,Undifferentiated services producing activities of private households for own use,Services,172,0,Other Service Activities,0,0,0,0,0,0,0,0,0
9900,,,Extra-territorial organizations and bodies,Services,173,0,Other Service Activities,0,0,0,0,0,0,0,0,0