Id,Label,timeset,subactivity,mainindustry,componentnumber,modularity_class,mainactivity,clustering,triangles,Degree,Weighted Degree,Eccentricity,closnesscentrality,harmonicclosnesscentrality,betweenesscentrality,eigencentrality
1543,,,Manufacture of margarine and similar edible fats,Manufacture of Food,0,2,Manufacture of Food; Beverages & Tobacco,0,0,1,0.996128,6,0.258824,0.274148,0,0.017671
1587,,,Manufacture of condiments and seasonings,Manufacture of Food,0,2,Manufacture of Food; Beverages & Tobacco,0,0,1,0.988326,6,0.258824,0.274148,0,0.017671
9001,,,Collection and treatment of sewage,Services,0,0,Other Social & Personal Services,1,1,2,1.972092,6,0.261321,0.276515,0,0.017398
1110,,,Extraction of crude petroleum and natural gas,Minning,0,5,Mining and Quarrying,1,1,2,1.970127,7,0.257122,0.271476,0,0.017148
2225,,,Ancillary activities related to printing,Manufacture Paper; Publishing; Printing,0,9,Manufacture Paper; Publishing; Printing,1,1,2,1.946539,7,0.240437,0.255946,0,0.016306
2224,,,Pre-press activities,Manufacture Paper; Publishing; Printing,0,9,Manufacture Paper; Publishing; Printing,1,1,2,1.898495,7,0.240437,0.255946,0,0.016306
2221,,,Printing of newspapers,Manufacture Paper; Publishing; Printing,0,3,Manufacture Paper; Publishing; Printing,0,0,1,0.978715,6,0.255814,0.269129,0,0.015931
9240,,,News agency activities,Services,0,3,"Recreational, Cultural & Sporting",0,0,1,0.91073,6,0.255814,0.269129,0,0.015931
2412,,,Manufacture of dyes and pigments,Manufacture Chemicals/Plastics,0,8,"Manufacture Chemicals, Prods & Man-Made",0,0,1,0.978992,6,0.257498,0.271591,0,0.015834
3663,,,Other manufacturing n.e.c.,Manufacture Other,0,7,Manufacturing nec,0,0,1,0.90765,7,0.241096,0.25744,0,0.014954
4011,,,Production of electricity,"Electricity, Gas and Water Supply",0,0,"Electricity, Gas and Water Supply",1,1,2,1.966351,6,0.251249,0.265483,0,0.014777
4532,,,Insulation work activities,Construction,0,4,Construction,0,0,1,0.977364,6,0.248588,0.261553,0,0.014571
5512,,,,,0,1,,0,0,1,0.979879,7,0.233732,0.247984,0,0.014356
2223,,,Bookbinding,Manufacture Paper; Publishing; Printing,0,9,Manufacture Paper; Publishing; Printing,0,0,1,0.948424,7,0.240273,0.254525,0,0.014172
2123,,,Manufacture of paper stationery,Manufacture Paper; Publishing; Printing,0,9,Manufacture Paper; Publishing; Printing,0,0,1,0.945955,7,0.240273,0.254525,0,0.014172
2215,,,Other publishing,Manufacture Paper; Publishing; Printing,0,9,Manufacture Paper; Publishing; Printing,0,0,1,0.932983,7,0.240273,0.254525,0,0.014172
7481,,,"Portrait photographic activities,Other specialist photography,Film processing,Photographic activities not elsewhere classified",Buisness activities,0,9,Other Business Activities,0,0,1,0.769729,7,0.240273,0.254525,0,0.014172
1552,,,Manufacture of ice cream,Manufacture of Food,0,2,Manufacture of Food; Beverages & Tobacco,0,0,1,0.97341,7,0.244105,0.259686,0,0.01372
2511,,,Manufacture of rubber tyres and tubes,Manufacture Chemicals/Plastics,0,6,Manufacture of Rubber & Plastic Products,0,0,1,0.943217,7,0.246154,0.26085,0,0.013343
9132,,,Activities of political organizations,Services,0,3,Membership Organisations,0,0,1,0.362855,7,0.226512,0.243669,0,0.012606
6022,,,Taxi operation,Transport,0,3,Transport,0,0,1,0.049915,7,0.226512,0.243669,0,0.012606
6311,,,Cargo handling,Transport,0,0,Transport,0,0,1,0.972154,7,0.248062,0.261391,0,0.012166
5232,,,Retail sale of hearing aids,Retail,0,8,"Retail Trade, Not Motors; Repairs",0,0,1,0.977604,7,0.243936,0.257271,0,0.011921
2122,,,Manufacture of household and sanitary goods and of toilet requisites,Manufacture Paper; Publishing; Printing,0,8,Manufacture Paper; Publishing; Printing,0,0,1,0.909598,7,0.243936,0.257271,0,0.011921
6602,,,Pension funding,Finance,0,3,Finance,0,0,1,0.957471,7,0.223919,0.234855,0,0.011381
3615,,,Manufacture of mattresses,Manufacture Other,0,4,Manufacturing nec,0,0,1,0.976688,7,0.245639,0.258455,0,0.010916
9211,,,"Motion picture production on film or video, Other motion picture and video production activities",Services,0,3,"Recreational, Cultural & Sporting",0,0,1,0.958732,7,0.232037,0.243994,0,0.010128
6711,,,Administration of financial markets,Finance,0,3,Finance,0,0,1,0.814266,7,0.225496,0.236391,0,0.00974
6511,,,Central banking,Finance,0,3,Finance,0,0,1,0.813643,7,0.225496,0.236391,0,0.00974
1412,,,"Quarrying of limestone, gypsum and chalk",Minning,0,5,Mining and Quarrying,0,0,1,0.996738,6,0.248412,0.260133,0,0.009572
1411,,,Quarrying of  ornamental and building stone,Minning,0,5,Mining and Quarrying,0,0,1,0.996338,6,0.248412,0.260133,0,0.009572
1422,,,Mining of clays and kaolin,Minning,0,5,Mining and Quarrying,0,0,1,0.990041,6,0.248412,0.260133,0,0.009572
2663,,,Manufacture of ready-mixed concrete,Manufacture Other,0,5,Manufacture Other Non-Metal Mineral Products,0,0,1,0.989609,6,0.248412,0.260133,0,0.009572
7485,,,Secretarial and translation activities,Buisness activities,0,3,Other Business Activities,0,0,1,0.997836,6,0.243094,0.254593,0,0.009432
4200,,,,,0,0,,0,0,1,0.995081,6,0.250534,0.262263,0,0.009394
111,,,Growing of cereals and other crops n.e.c.,"Agriculture, Hunting and Forestry",0,10,"Agriculture, Hunting and Forestry",1,1,2,1.949622,7,0.23219,0.247639,0,0.009273
1772,,,"Manufacture of knitted and crocheted pullovers, cardigans and similar articles",Manufacture of Textiles and Leather,0,5,Manufacture of Textiles & Textile Products,0,0,1,0.943164,7,0.229167,0.241592,0,0.008562
5135,,,Wholesale of tobacco products,Retail,0,2,"Wholesale, Retail; Certain Repair (cont.)",0,0,1,0.974746,7,0.233267,0.246719,0,0.008371
9003,,,"Sanitation, remediation and similar activities",Services,0,0,Other Social & Personal Services,0,0,1,0.996917,6,0.237838,0.250047,0,0.008004
8041,,,Driving school activities,Gouverment,0,3,Education,0,0,1,0.689156,7,0.212048,0.227976,0,0.007808
2462,,,Manufacture of glues and gelatines,Manufacture Chemicals/Plastics,0,8,"Manufacture Chemicals, Prods & Man-Made",0,0,1,0.98525,7,0.236718,0.248823,0,0.006681
123,,,Farming of swine,"Agriculture, Hunting and Forestry",0,10,"Agriculture, Hunting and Forestry",0,0,1,0.993893,7,0.220551,0.233252,0,0.005053
125,,,Other farming of animals,"Agriculture, Hunting and Forestry",0,10,"Agriculture, Hunting and Forestry",0,0,1,0.98847,7,0.220551,0.233252,0,0.005053
122,,,"Farming of sheep, goats, horses, asses, mules and hinnies","Agriculture, Hunting and Forestry",0,10,"Agriculture, Hunting and Forestry",0,0,1,0.98132,7,0.220551,0.233252,0,0.005053
121,,,"Farming of cattle, dairy farming","Agriculture, Hunting and Forestry",0,10,"Agriculture, Hunting and Forestry",0,0,1,0.981192,7,0.220551,0.233252,0,0.005053
5522,,,"Camping sites, including caravan sites",Hotels and Restaurants,0,1,Hotels and Restaurants,0,0,1,0.996733,7,0.219451,0.230851,0,0.005008
2722,,,Manufacture of steel tubes,Metals,0,7,Basic Metals & Fabricated Products,0,0,1,0.981145,7,0.215422,0.225913,0,0.004121
2943,,,Manufacture of other machine tools n.e.c.,"Manufacture of Machinery, Electrical",0,7,Manufacture of Machinery & Equipment,0,0,1,0.997829,7,0.202882,0.214421,0,0.00412
2942,,,Manufacture of other metalworking machine tools,"Manufacture of Machinery, Electrical",0,7,Manufacture of Machinery & Equipment,0,0,1,0.997829,7,0.202882,0.214421,0,0.00412
2941,,,Manufacture of portable hand held power tools,"Manufacture of Machinery, Electrical",0,7,Manufacture of Machinery & Equipment,0,0,1,0.997829,7,0.202882,0.214421,0,0.00412
1591,,,Manufacture of distilled potable alcoholic beverages,Manufacture of Food,0,1,Manufacture of Food; Beverages & Tobacco,0,0,1,0.961843,7,0.207792,0.218811,0,0.003886
2872,,,Manufacture of light metal packaging,Metals,0,9,"Manufacture Fabricated Metal, Not Machines",0,0,1,0.97467,8,0.212048,0.222447,0,0.003581
9120,,,Activities of trade unions,Services,0,3,Membership Organisations,0,0,1,0.984467,8,0.201258,0.211279,0,0.003098
2611,,,Manufacture of flat glass,Manufacture Other,0,4,Manufacture Other Non-Metal Mineral Products,0,0,1,0.996596,8,0.208284,0.218138,0,0.003007
2951,,,Manufacture of machinery for metallurgy,"Manufacture of Machinery, Electrical",0,7,Manufacture of Machinery & Equipment,0,0,1,0.995428,7,0.200799,0.210552,0,0.002881
7524,,,"Public security, law and order activities",Gouverment,0,3,Public Administration & Defence,0,0,1,0.344356,8,0.188943,0.199669,0,0.002418
2732,,,Cold rolling of narrow strip,Metals,0,4,Basic Metals & Fabricated Products,0,0,1,0.987499,7,0.197199,0.206311,0,0.002347
5162,,,,,0,6,,0,0,1,0.999135,8,0.197864,0.206581,0,0.001983
4022,,,Distribution and trade of gaseous fuels through mains,"Electricity, Gas and Water Supply",0,7,"Electricity, Gas and Water Supply",0,0,1,0.999348,7,0.193194,0.20023,0,0.00151
5188,,,"Wholesale of agricultural machinery and accessories and implements, including tractors",Retail,0,4,Wholesale of other household goods n.e.c.,0,0,1,0.998408,8,0.178228,0.184798,0,0.001301
1586,,,Tea processing Production of coffee and coffee substitutes,Manufacture of Food,2,0,Manufacture of Food; Beverages & Tobacco,0,0,1,0.98282,6,0.268533,0.279155,0,0.0009
5161,,,,,38,0,,0,0,1,0.999635,1,1,1,0,0.000284
5181,,,Wholesale of machine tools,Retail,38,0,Wholesale of other household goods n.e.c.,0,0,1,0.999635,1,1,1,0,0.000284
5274,,,Repair n.e.c.,Retail,65,0,"Retail Trade, Not Motors; Repairs",0,0,1,0.999182,1,1,1,0,0.000284
5271,,,"Repair of boots, shoes and other articles of leather",Retail,65,0,"Retail Trade, Not Motors; Repairs",0,0,1,0.999182,1,1,1,0,0.000284
2754,,,Casting of other non-ferrous metals,Metals,22,0,Basic Metals & Fabricated Products,0,0,1,0.99776,1,1,1,0,0.000284
2753,,,Casting of light metals,Metals,22,0,Basic Metals & Fabricated Products,0,0,1,0.99776,1,1,1,0,0.000284
2822,,,Manufacture of central heating radiators and boilers,Metals,19,0,"Manufacture Fabricated Metal, Not Machines",0,0,1,0.997211,1,1,1,0,0.000284
2622,,,Manufacture of ceramic sanitary fixtures,Manufacture Other,19,0,Manufacture Other Non-Metal Mineral Products,0,0,1,0.997211,1,1,1,0,0.000284
1754,,,Manufacture of narrow fabricsManufacture of other textiles n.e.c.Manufacture of lace,Manufacture of Textiles and Leather,6,0,Manufacture of Textiles & Textile Products,0,0,1,0.995911,1,1,1,0,0.000284
1724,,,Silk-type weaving,Manufacture of Textiles and Leather,6,0,Manufacture of Textiles & Textile Products,0,0,1,0.995911,1,1,1,0,0.000284
1571,,,Manufacture of prepared feeds for farm animals,Manufacture of Food,13,0,Manufacture of Food; Beverages & Tobacco,0,0,1,0.989592,1,1,1,0,0.000284
5121,,,"Wholesale of grain, seeds and animal feeds",Retail,13,0,"Wholesale, Retail; Certain Repair (cont.)",0,0,1,0.989592,1,1,1,0,0.000284
2851,,,Treatment and coating of metals,Metals,3,0,"Manufacture Fabricated Metal, Not Machines",0,0,0,0,0,0,0,0,0
1751,,,Manufacture of woven/tufted/other carpets and rugs,Manufacture of Textiles and Leather,4,0,Manufacture of Textiles & Textile Products,0,0,0,0,0,0,0,0,0
2751,,,Casting of iron,Metals,5,0,Basic Metals & Fabricated Products,0,0,0,0,0,0,0,0,0
1598,,,Production of mineral waters and soft drinks,Manufacture of Food,7,0,Manufacture of Food; Beverages & Tobacco,0,0,0,0,0,0,0,0,0
1930,,,Manufacture of footwear,Manufacture of Textiles and Leather,8,0,Manufacture of Leather & Leather Products,0,0,0,0,0,0,0,0,0
2863,,,Manufacture of locks and hinges,Metals,9,0,"Manufacture Fabricated Metal, Not Machines",0,0,0,0,0,0,0,0,0
2613,,,Manufacture of hollow glass,Manufacture Other,10,0,Manufacture Other Non-Metal Mineral Products,0,0,0,0,0,0,0,0,0
2742,,,Aluminium production,Metals,11,0,Basic Metals & Fabricated Products,0,0,0,0,0,0,0,0,0
5141,,,Wholesale of textiles,Retail,12,0,"Wholesale, Retail; Certain Repair (cont.)",0,0,0,0,0,0,0,0,0
2640,,,"Manufacture of bricks, tiles and construction products, in baked clay",Manufacture Other,14,0,Manufacture Other Non-Metal Mineral Products,0,0,0,0,0,0,0,0,0
9111,,,Activities of business and employers' organizations,Services,15,0,Membership Organisations,0,0,0,0,0,0,0,0,0
2972,,,Manufacture of non-electric domestic appliances,"Manufacture of Machinery, Electrical",16,0,Manufacture of Machinery & Equipment,0,0,0,0,0,0,0,0,0
2830,,,"Manufacture of steam generators, except central heating hot water boilers",Metals,17,0,"Manufacture Fabricated Metal, Not Machines",0,0,0,0,0,0,0,0,0
2682,,,manufacture of asbestos,Manufacture Other,18,0,Manufacture Other Non-Metal Mineral Products,0,0,0,0,0,0,0,0,0
4543,,,Floor and wall covering,Construction,20,0,Construction,0,0,0,0,0,0,0,0,0
5157,,,Wholesale of waste and scrap,Retail,21,0,Wholesale of other household goods n.e.c.,0,0,0,0,0,0,0,0,0
3650,,,"Manufacture of other games and toys, n.e.c.",Manufacture Other,23,0,Manufacturing nec,0,0,0,0,0,0,0,0,0
3512,,,Building and repairing of pleasure and sporting boats,Manufacture of Transport Equipment,24,0,Manufacture of Other Transport Equipment,0,0,0,0,0,0,0,0,0
2744,,,Copper production,Metals,25,0,Basic Metals & Fabricated Products,0,0,0,0,0,0,0,0,0
2626,,,Manufacture of refractory ceramic products,Manufacture Other,26,0,Manufacture Other Non-Metal Mineral Products,0,0,0,0,0,0,0,0,0
2040,,,Manufacture of wooden containers,Manufacture of Wood & Wood Product,27,0,Manufacture of Wood & Wood Product,0,0,0,0,0,0,0,0,0
2051,,,Manufacture of other products of wood,Manufacture of Wood & Wood Product,28,0,Manufacture of Wood & Wood Product,0,0,0,0,0,0,0,0,0
3710,,,Recycling of metal waste and scrap,Recycling,29,0,Recycling,0,0,0,0,0,0,0,0,0
1600,,,Manufacture of tobacco products,Manufacture of Textiles,30,0,Manufacture of Textiles & Textile Products,0,0,0,0,0,0,0,0,0
2873,,,Manufacture of wire products,Metals,31,0,"Manufacture Fabricated Metal, Not Machines",0,0,0,0,0,0,0,0,0
2821,,,"Manufacture of tanks, reservoirs and containers of metal",Metals,32,0,"Manufacture Fabricated Metal, Not Machines",0,0,0,0,0,0,0,0,0
1821,,,Manufacture of workwear,Manufacture of Textiles and Leather,33,0,Manufacture of Textiles & Textile Products,0,0,0,0,0,0,0,0,0
201,,,Forestry and logging,"Agriculture, Hunting and Forestry",34,0,"Agriculture, Hunting and Forestry",0,0,0,0,0,0,0,0,0
3640,,,Manufacture of sports goods,Manufacture Other,35,0,Manufacturing nec,0,0,0,0,0,0,0,0,0
5118,,,Agents specializing in the sale of particular products or ranges of products n.e.c.,Retail,36,0,"Wholesale, Retail; Certain Repair (cont.)",0,0,0,0,0,0,0,0,0
2020,,,"Manufacture of veneer sheets; manufacture of plywood, laminboard, particle board, fibre board and other panels and boards",Manufacture of Wood & Wood Product,37,0,Manufacture of Wood & Wood Product,0,0,0,0,0,0,0,0,0
2651,,,Manufacture of cement,Manufacture Other,39,0,Manufacture Other Non-Metal Mineral Products,0,0,0,0,0,0,0,0,0
1713,,,Preparation and spinning of worsted-type fibres,Manufacture of Textiles and Leather,40,0,Manufacture of Textiles & Textile Products,0,0,0,0,0,0,0,0,0
1920,,,"Manufacture of luggage, handbags and the like, saddlery and harness",Manufacture of Textiles and Leather,41,0,Manufacture of Leather & Leather Products,0,0,0,0,0,0,0,0,0
2615,,,"Manufacture and processing of other glass, including technical glassware",Manufacture Other,42,0,Manufacture Other Non-Metal Mineral Products,0,0,0,0,0,0,0,0,0
1712,,,Preparation and spinning of woollen-type fibres,Manufacture of Textiles and Leather,43,0,Manufacture of Textiles & Textile Products,0,0,0,0,0,0,0,0,0
3140,,,"Manufacture of accumulators, primary cells and primary batteries","Manufacture of Machinery, Electrical",44,0,Manufacture of Electrical Machinery etc.,0,0,0,0,0,0,0,0,0
3622,,,Manufacture of jewellery and related articles n.e.c.,Manufacture Other,45,0,Manufacturing nec,0,0,0,0,0,0,0,0,0
4541,,,Plastering,Construction,46,0,Construction,0,0,0,0,0,0,0,0,0
5122,,,Wholesale of flowers and plants,Retail,47,0,"Wholesale, Retail; Certain Repair (cont.)",0,0,0,0,0,0,0,0,0
2752,,,Casting of steel,Metals,48,0,Basic Metals & Fabricated Products,0,0,0,0,0,0,0,0,0
9212,,,Motion picture and video distribution,Services,49,0,"Recreational, Cultural & Sporting",0,0,0,0,0,0,0,0,0
1572,,,Manufacture of prepared pet foods,Manufacture of Food,50,0,Manufacture of Food; Beverages & Tobacco,0,0,0,0,0,0,0,0,0
2614,,,Manufacture of glass fibres,Manufacture Other,51,0,Manufacture Other Non-Metal Mineral Products,0,0,0,0,0,0,0,0,0
2124,,,Manufacture of wallpaper,Manufacture Paper; Publishing; Printing,52,0,Manufacture Paper; Publishing; Printing,0,0,0,0,0,0,0,0,0
1760,,,Manufacture of knitted and crocheted fabrics,Manufacture of Textiles and Leather,53,0,Manufacture of Textiles & Textile Products,0,0,0,0,0,0,0,0,0
2681,,,Production of abrasive products,Manufacture Other,54,0,Manufacture Other Non-Metal Mineral Products,0,0,0,0,0,0,0,0,0
1910,,,Tanning and dressing of leather,Manufacture of Textiles and Leather,55,0,Manufacture of Leather & Leather Products,0,0,0,0,0,0,0,0,0
2734,,,Wire drawing,Metals,56,0,Basic Metals & Fabricated Products,0,0,0,0,0,0,0,0,0
2745,,,Other non-ferrous metal production,Metals,57,0,Basic Metals & Fabricated Products,0,0,0,0,0,0,0,0,0
1721,,,Cotton-type weaving,Manufacture of Textiles and Leather,58,0,Manufacture of Textiles & Textile Products,0,0,0,0,0,0,0,0,0
5136,,,Wholesale of sugar and chocolate and sugar confectionery,Retail,59,0,"Wholesale, Retail; Certain Repair (cont.)",0,0,0,0,0,0,0,0,0
2721,,,Manufacture of cast iron tubes,Metals,60,0,Basic Metals & Fabricated Products,0,0,0,0,0,0,0,0,0
9233,,,Fair and amusement park activities,Services,61,0,"Recreational, Cultural & Sporting",0,0,0,0,0,0,0,0,0
2954,,,"Manufacture of machinery for textile, apparel and leather production","Manufacture of Machinery, Electrical",62,0,Manufacture of Machinery & Equipment,0,0,0,0,0,0,0,0,0
2955,,,Manufacture of machinery for paper and paperboard production,"Manufacture of Machinery, Electrical",63,0,Manufacture of Machinery & Equipment,0,0,0,0,0,0,0,0,0
2921,,,Manufacture of furnaces and furnace burners,"Manufacture of Machinery, Electrical",64,0,Manufacture of Machinery & Equipment,0,0,0,0,0,0,0,0,0
1583,,,Manufacture of sugar,Manufacture of Food,66,0,Manufacture of Food; Beverages & Tobacco,0,0,0,0,0,0,0,0,0
2415,,,Manufacture of fertilizers and nitrogen compounds,Manufacture Chemicals/Plastics,67,0,"Manufacture Chemicals, Prods & Man-Made",0,0,0,0,0,0,0,0,0
2231,,,Reproduction of sound recording,Manufacture Paper; Publishing; Printing,68,0,Manufacture Paper; Publishing; Printing,0,0,0,0,0,0,0,0,0
2670,,,"Cutting, shaping and finishing of ornamental and building stone",Manufacture Other,69,0,Manufacture Other Non-Metal Mineral Products,0,0,0,0,0,0,0,0,0
3662,,,Manufacture of brooms and brushes,Manufacture Other,70,0,Manufacturing nec,0,0,0,0,0,0,0,0,0
2861,,,Manufacture of cutlery,Metals,71,0,"Manufacture Fabricated Metal, Not Machines",0,0,0,0,0,0,0,0,0
2463,,,Manufacture of essential oils,Manufacture Chemicals/Plastics,72,0,"Manufacture Chemicals, Prods & Man-Made",0,0,0,0,0,0,0,0,0
2630,,,Manufacture of ceramic tiles and flags,Manufacture Other,73,0,Manufacture Other Non-Metal Mineral Products,0,0,0,0,0,0,0,0,0
2417,,,Manufacture of synthetic rubber in primary forms,Manufacture Chemicals/Plastics,74,0,"Manufacture Chemicals, Prods & Man-Made",0,0,0,0,0,0,0,0,0
2871,,,Manufacture of steel drums and similar containers,Metals,75,0,"Manufacture Fabricated Metal, Not Machines",0,0,0,0,0,0,0,0,0
5117,,,"Agents involved in the sale of food, beverages and tobacco",Retail,76,0,"Wholesale, Retail; Certain Repair (cont.)",0,0,0,0,0,0,0,0,0
1723,,,Worsted-type weaving,Manufacture of Textiles and Leather,77,0,Manufacture of Textiles & Textile Products,0,0,0,0,0,0,0,0,0
1753,,,"Manufacture of non-wovens and articles made from non-wovens, except apparel",Manufacture of Textiles and Leather,78,0,Manufacture of Textiles & Textile Products,0,0,0,0,0,0,0,0,0
502,,,Fish farming,"Agriculture, Hunting and Forestry",79,0,Fishing,0,0,0,0,0,0,0,0,0
3542,,,Manufacture of bicycles,Manufacture of Transport Equipment,80,0,Manufacture of Other Transport Equipment,0,0,0,0,0,0,0,0,0
5137,,,"Wholesale of coffee, tea, cocoa and spices",Retail,81,0,"Wholesale, Retail; Certain Repair (cont.)",0,0,0,0,0,0,0,0,0
3720,,,Recycling of non-metal waste and scrap,Recycling,82,0,Recycling,0,0,0,0,0,0,0,0,0
1532,,,Manufacture of fruit and vegetable juice,Manufacture of Food,83,0,Manufacture of Food; Beverages & Tobacco,0,0,0,0,0,0,0,0,0
5119,,,Agents involved in the sale of a variety of goods,Retail,84,0,"Wholesale, Retail; Certain Repair (cont.)",0,0,0,0,0,0,0,0,0
1725,,,Other textile weaving,Manufacture of Textiles and Leather,85,0,Manufacture of Textiles & Textile Products,0,0,0,0,0,0,0,0,0
1722,,,Woollen-type weaving,Manufacture of Textiles and Leather,86,0,Manufacture of Textiles & Textile Products,0,0,0,0,0,0,0,0,0
2662,,,Manufacture of plaster products for construction purposes,Manufacture Other,87,0,Manufacture Other Non-Metal Mineral Products,0,0,0,0,0,0,0,0,0
9234,,,Other entertainment activities not elsewhere classified,Services,88,0,"Recreational, Cultural & Sporting",0,0,0,0,0,0,0,0,0
1597,,,Manufacture of malt,Manufacture of Food,89,0,Manufacture of Food; Beverages & Tobacco,0,0,0,0,0,0,0,0,0
2512,,,Retreading and rebuilding of rubber tyres,Manufacture Chemicals/Plastics,90,0,Manufacture of Rubber & Plastic Products,0,0,0,0,0,0,0,0,0
5163,,,,,91,0,,0,0,0,0,0,0,0,0,0
2470,,,Manufacture of man-made fibres,Manufacture Chemicals/Plastics,92,0,"Manufacture Chemicals, Prods & Man-Made",0,0,0,0,0,0,0,0,0
5111,,,"Agents involved in the sale of agricultural raw materials, live animals, textile raw materials and semi-finished goods",Retail,93,0,"Wholesale, Commission, Not Motors",0,0,0,0,0,0,0,0,0
1585,,,"Manufacture of macaroni, noodles, couscous and similar farinaceous products",Manufacture of Food,94,0,Manufacture of Food; Beverages & Tobacco,0,0,0,0,0,0,0,0,0
5521,,,Youth hostels and mountain refuges,Hotels and Restaurants,95,0,Hotels and Restaurants,0,0,0,0,0,0,0,0,0
2233,,,Reproduction of computer media,Manufacture Paper; Publishing; Printing,96,0,Manufacture Paper; Publishing; Printing,0,0,0,0,0,0,0,0,0
1716,,,Manufacture of sewing threads,Manufacture of Textiles and Leather,97,0,Manufacture of Textiles & Textile Products,0,0,0,0,0,0,0,0,0
1711,,,Preparation and spinning of cotton-type fibres,Manufacture of Textiles and Leather,98,0,Manufacture of Textiles & Textile Products,0,0,0,0,0,0,0,0,0
501,,,Fishing,"Agriculture, Hunting and Forestry",99,0,Fishing,0,0,0,0,0,0,0,0,0
5112,,,"Agents involved in the sale of fuels, ores, metals and industrial chemicals",Retail,100,0,"Wholesale, Commission, Not Motors",0,0,0,0,0,0,0,0,0
1594,,,Manufacture of cider and perry Manufacture of other fermented fruit beverages,Manufacture of Food,101,0,Manufacture of Food; Beverages & Tobacco,0,0,0,0,0,0,0,0,0
5113,,,Agents involved in the sale of timber and building materials,Retail,102,0,"Wholesale, Commission, Not Motors",0,0,0,0,0,0,0,0,0
2232,,,Reproduction of video recording,Manufacture Paper; Publishing; Printing,103,0,Manufacture Paper; Publishing; Printing,0,0,0,0,0,0,0,0,0
2461,,,Manufacture of explosives,Manufacture Chemicals/Plastics,104,0,"Manufacture Chemicals, Prods & Man-Made",0,0,0,0,0,0,0,0,0
2310,,,Manufacture of coke oven products,Manufacture Paper; Publishing; Printing,105,0,Manufacture Paper; Publishing; Printing,0,0,0,0,0,0,0,0,0
2743,,,"Lead, zinc and tin production",Metals,106,0,Basic Metals & Fabricated Products,0,0,0,0,0,0,0,0,0
2733,,,Cold forming or folding,Metals,107,0,Basic Metals & Fabricated Products,0,0,0,0,0,0,0,0,0
1562,,,Manufacture of starches and starch products,Manufacture of Food,108,0,Manufacture of Food; Beverages & Tobacco,0,0,0,0,0,0,0,0,0
2411,,,Manufacture of industrial gases,Manufacture Chemicals/Plastics,109,0,"Manufacture Chemicals, Prods & Man-Made",0,0,0,0,0,0,0,0,0
3543,,,Manufacture of invalid carriages,Manufacture of Transport Equipment,110,0,Manufacture of Other Transport Equipment,0,0,0,0,0,0,0,0,0
3630,,,Manufacture of musical instruments,Manufacture Other,111,0,Manufacturing nec,0,0,0,0,0,0,0,0,0
2741,,,Precious metals production,Metals,112,0,Basic Metals & Fabricated Products,0,0,0,0,0,0,0,0,0
2666,,,"Manufacture of other articles of concrete, plaster and cement",Manufacture Other,113,0,Manufacture Other Non-Metal Mineral Products,0,0,0,0,0,0,0,0,0
2735,,,,,114,0,,0,0,0,0,0,0,0,0,0
5115,,,"Agents involved in the sale of furniture, household goods, hardware and ironmongery",Retail,115,0,"Wholesale, Retail; Certain Repair (cont.)",0,0,0,0,0,0,0,0,0
1752,,,"Manufacture of cordage, rope, twine and netting",Manufacture of Textiles and Leather,116,0,Manufacture of Textiles & Textile Products,0,0,0,0,0,0,0,0,0
202,,,Forestry and logging related service activities,"Agriculture, Hunting and Forestry",117,0,"Agriculture, Hunting and Forestry",0,0,0,0,0,0,0,0,0
2624,,,Manufacture of other technical ceramic products,Manufacture Other,118,0,Manufacture Other Non-Metal Mineral Products,0,0,0,0,0,0,0,0,0
5124,,,Wholesale of furskins,Retail,119,0,"Wholesale, Retail; Certain Repair (cont.)",0,0,0,0,0,0,0,0,0
3350,,,Manufacture of watches and clocks,"Manufacture of Machinery, Electrical",120,0,Manufacture Medical & Precision Instruments,0,0,0,0,0,0,0,0,0
2665,,,Manufacture of fibre cement,Manufacture Other,121,0,Manufacture Other Non-Metal Mineral Products,0,0,0,0,0,0,0,0,0
1715,,,"Throwing and preparation of silk, including from noils, and throwing and texturing of synthetic or artificial filament yarns",Manufacture of Textiles and Leather,122,0,Manufacture of Textiles & Textile Products,0,0,0,0,0,0,0,0,0
1430,,,Mining of chemical and fertilizer minerals,Minning,123,0,Mining and Quarrying,0,0,0,0,0,0,0,0,0
1588,,,Manufacture of homogenized food preparations and dietetic food,Manufacture of Food,124,0,Manufacture of Food; Beverages & Tobacco,0,0,0,0,0,0,0,0,0
7131,,,Renting of agricultural machinery and equipment,Buisness activities,125,0,Renting Equipment Without Operator,0,0,0,0,0,0,0,0,0
